{
  "operation_id": "wp.plan.content_model",
  "legacy_op_id": "draft_content_model",
  "version": "1.0.0",
  "title": "Plan Content_Model",
  "description": "Content model proposal",
  "category": "planning",
  "lifecycle_status": "DEFINED",
  "implementation_status": "UNBOUND",
  "risk_class": "R1",
  "environment_scope": [
    "BRAIN_ONLY"
  ],
  "production_allowed": false,
  "input_schema": {
    "type": "object",
    "properties": {
      "project_id": {
        "type": "string"
      },
      "runtime_id": {
        "type": "string"
      },
      "source_commit": {
        "type": "string"
      },
      "approval_reference": {
        "type": "string"
      }
    },
    "additionalProperties": true
  },
  "output_schema": {
    "type": "object",
    "properties": {
      "report_type": {
        "const": "content_model"
      },
      "status": {
        "enum": [
          "SUCCEEDED",
          "FAILED",
          "BLOCKED_SAFE_UNKNOWN"
        ]
      },
      "evidence_paths": {
        "type": "array",
        "items": {
          "type": "string"
        }
      }
    }
  },
  "preconditions": [
    "AG-WP-001 agent registered; runtime NOT required for BRAIN_ONLY ops",
    "environment_scope matches operation allowlist",
    "production_allowed is false"
  ],
  "postconditions": [
    "execution envelope schema-compatible artifact emitted (when harness exists)",
    "audit_evidence paths recorded without secrets"
  ],
  "invariants": [
    "No production mutation",
    "No credential emission in logs",
    "Risk class not escalated without approval"
  ],
  "approval": {
    "required": true,
    "risk_gate": "R1",
    "token_required": false,
    "pre_authorized_local": false
  },
  "approval_evidence": [
    "approval_id",
    "approved_scope",
    "source_commit"
  ],
  "tool_binding": {
    "binding_id": "UNBOUND",
    "tool_ids": [],
    "invocation_class": "unbound"
  },
  "tool_status": "UNBOUND",
  "idempotency": "NON_IDEMPOTENT",
  "side_effects": "READ_ONLY_ARTIFACTS",
  "rollback": {
    "required": false,
    "method": "not_applicable",
    "automatic": false
  },
  "audit_evidence": [
    "execution_id",
    "operation_id",
    "started_at",
    "status"
  ],
  "success_criteria": [
    "Emit content_model without BLOCKER failure codes"
  ],
  "failure_codes": [
    "WP_SAFE_UNKNOWN_BLOCKING",
    "WP_ENVIRONMENT_SCOPE_VIOLATION",
    "WP_APPROVAL_REQUIRED",
    "WP_APPROVAL_SCOPE_MISMATCH"
  ],
  "safe_unknown_behavior": "BLOCK",
  "timeout_policy": {
    "default_seconds": 120,
    "max_seconds": 600
  },
  "retry_policy": {
    "retryable": false,
    "max_attempts": 0
  },
  "secret_policy": "NO_ACCESS",
  "logging_policy": {
    "sanitize_secrets": true,
    "redact_paths": [
      "wp-config.php",
      "runtime.env",
      ".env"
    ]
  },
  "dependencies": [],
  "conflicts": [],
  "allowed_next_operations": []
}
